<?xml version="1.0" encoding="UTF-8"?>
<schemaMapping xmlns="http://www.3dcitydb.org/database/schema/1.0" xmlns:xsi="http://www.w3.org/2001/XMLSchema-instance" xsi:schemaLocation="http://www.3dcitydb.org/database/schema/1.0 3dcitydb-schema.xsd">

  <applicationSchemas>
    <schema id="core" xmlPrefix="core">
      <namespace context="citygml-2.0">http://www.opengis.net/citygml/2.0</namespace>
      <namespace context="citygml-1.0">http://www.opengis.net/citygml/1.0</namespace>
    </schema>
    <schema id="app" xmlPrefix="app">
      <namespace context="citygml-2.0">http://www.opengis.net/citygml/appearance/2.0</namespace>
      <namespace context="citygml-1.0">http://www.opengis.net/citygml/appearance/1.0</namespace>
    </schema>
    <schema id="bldg" xmlPrefix="bldg">
      <namespace context="citygml-2.0">http://www.opengis.net/citygml/building/2.0</namespace>
      <namespace context="citygml-1.0">http://www.opengis.net/citygml/building/1.0</namespace>
    </schema>
    <schema id="brid" xmlPrefix="brid">
      <namespace context="citygml-2.0">http://www.opengis.net/citygml/bridge/2.0</namespace>
    </schema>
    <schema id="frn" xmlPrefix="frn">
      <namespace context="citygml-2.0">http://www.opengis.net/citygml/cityfurniture/2.0</namespace>
      <namespace context="citygml-1.0">http://www.opengis.net/citygml/cityfurniture/1.0</namespace>
    </schema>
    <schema id="grp" xmlPrefix="grp">
      <namespace context="citygml-2.0">http://www.opengis.net/citygml/cityobjectgroup/2.0</namespace>
      <namespace context="citygml-1.0">http://www.opengis.net/citygml/cityobjectgroup/1.0</namespace>
    </schema>
    <schema id="gen" xmlPrefix="gen">
      <namespace context="citygml-2.0">http://www.opengis.net/citygml/generics/2.0</namespace>
      <namespace context="citygml-1.0">http://www.opengis.net/citygml/generics/1.0</namespace>
    </schema>
    <schema id="luse" xmlPrefix="luse">
      <namespace context="citygml-2.0">http://www.opengis.net/citygml/landuse/2.0</namespace>
      <namespace context="citygml-1.0">http://www.opengis.net/citygml/landuse/1.0</namespace>
    </schema>
    <schema id="dem" xmlPrefix="dem">
      <namespace context="citygml-2.0">http://www.opengis.net/citygml/relief/2.0</namespace>
      <namespace context="citygml-1.0">http://www.opengis.net/citygml/relief/1.0</namespace>
    </schema>
    <schema id="tran" xmlPrefix="tran">
      <namespace context="citygml-2.0">http://www.opengis.net/citygml/transportation/2.0</namespace>
      <namespace context="citygml-1.0">http://www.opengis.net/citygml/transportation/1.0</namespace>
    </schema>
    <schema id="tun" xmlPrefix="tun">
      <namespace context="citygml-2.0">http://www.opengis.net/citygml/tunnel/2.0</namespace>
    </schema>
    <schema id="veg" xmlPrefix="veg">
      <namespace context="citygml-2.0">http://www.opengis.net/citygml/vegetation/2.0</namespace>
      <namespace context="citygml-1.0">http://www.opengis.net/citygml/vegetation/1.0</namespace>
    </schema>
    <schema id="wtr" xmlPrefix="wtr">
      <namespace context="citygml-2.0">http://www.opengis.net/citygml/waterbody/2.0</namespace>
      <namespace context="citygml-1.0">http://www.opengis.net/citygml/waterbody/1.0</namespace>
    </schema>
    <schema id="gml" xmlPrefix="gml">
      <namespace context="citygml-2.0">http://www.opengis.net/gml</namespace>
      <namespace context="citygml-1.0">http://www.opengis.net/gml</namespace>
    </schema>
    <schema id="citydb" xmlPrefix="citydb">
      <namespace context="citygml-2.0">http://www.3dcitydb.org/citygml-ade/3.0</namespace>
      <namespace context="citygml-1.0">http://www.3dcitydb.org/citygml-ade/3.0</namespace>
    </schema>
  </applicationSchemas>

  <attributeTypes>
    <attributeType id="stringAttributeType" table="cityobject_genericattrib">
      <attribute path="@name" column="attrname" type="string" minOccurs="1" schema="gen"/>
      <attribute path="value" column="strval" type="string" minOccurs="1" schema="gen"/>
    </attributeType>

    <attributeType id="intAttributeType" table="cityobject_genericattrib">
      <attribute path="@name" column="attrname" type="string" minOccurs="1" schema="gen"/>
      <attribute path="value" column="intval" type="integer" minOccurs="1" schema="gen"/>
    </attributeType>

    <attributeType id="doubleAttributeType" table="cityobject_genericattrib">
      <attribute path="@name" column="attrname" type="string" minOccurs="1" schema="gen"/>
      <attribute path="value" column="realval" type="double" minOccurs="1" schema="gen"/>
    </attributeType>

    <attributeType id="uriAttributeType" table="cityobject_genericattrib">
      <attribute path="@name" column="attrname" type="string" minOccurs="1" schema="gen"/>
      <attribute path="value" column="urival" type="string" minOccurs="1" schema="gen"/>
    </attributeType>

    <attributeType id="dateAttributeType" table="cityobject_genericattrib">
      <attribute path="@name" column="attrname" type="string" minOccurs="1" schema="gen"/>
      <attribute path="value" column="dateval" type="date" minOccurs="1" schema="gen"/>
    </attributeType>

    <attributeType id="measureAttributeType" table="cityobject_genericattrib">
      <attribute path="@name" column="attrname" type="string" minOccurs="1" schema="gen"/>
      <complexAttribute path="value" schema="gen">
        <attribute path="." column="realval" type="double" minOccurs="1" schema="gen"/>
        <attribute path="@uom" column="unit" type="string" schema="gen"/>
      </complexAttribute>
    </attributeType>

    <attributeType id="genericAttributeSetType" table="cityobject_genericattrib">
      <attribute path="@name" column="attrname" type="string" minOccurs="1" schema="gen"/>
      <attribute path="@codeSpace" column="genattribset_codespace" type="string" schema="gen"/>
      <complexAttribute path="stringAttribute" type="stringAttributeType" schema="gen">
        <join table="cityobject_genericattrib" fromColumn="id" toColumn="parent_genattrib_id" toRole="child">
          <condition column="datatype" value="1" type="integer"/>
        </join>
      </complexAttribute>
      <complexAttribute path="intAttribute" type="intAttributeType" schema="gen">
        <join table="cityobject_genericattrib" fromColumn="id" toColumn="parent_genattrib_id" toRole="child">
          <condition column="datatype" value="2" type="integer"/>
        </join>
      </complexAttribute>
      <complexAttribute path="doubleAttribute" type="doubleAttributeType" schema="gen">
        <join table="cityobject_genericattrib" fromColumn="id" toColumn="parent_genattrib_id" toRole="child">
          <condition column="datatype" value="3" type="integer"/>
        </join>
      </complexAttribute>
      <complexAttribute path="uriAttribute" type="uriAttributeType" schema="gen">
        <join table="cityobject_genericattrib" fromColumn="id" toColumn="parent_genattrib_id" toRole="child">
          <condition column="datatype" value="4" type="integer"/>
        </join>
      </complexAttribute>
      <complexAttribute path="dateAttribute" type="dateAttributeType" schema="gen">
        <join table="cityobject_genericattrib" fromColumn="id" toColumn="parent_genattrib_id" toRole="child">
          <condition column="datatype" value="5" type="integer"/>
        </join>
      </complexAttribute>
      <complexAttribute path="measureAttribute" type="measureAttributeType" schema="gen">
        <join table="cityobject_genericattrib" fromColumn="id" toColumn="parent_genattrib_id" toRole="child">
          <condition column="datatype" value="6" type="integer"/>
        </join>
      </complexAttribute>
      <complexAttribute path="genericAttributeSet" type="genericAttributeSetType" schema="gen">
        <join table="cityobject_genericattrib" fromColumn="id" toColumn="parent_genattrib_id" toRole="child">
          <condition column="datatype" value="7" type="integer"/>
        </join>
      </complexAttribute>
    </attributeType>
  </attributeTypes>
  
  <objectTypes>
    <!-- GML module -->
    <objectType id="AbstractGMLType" path="_GML" table="cityobject" objectClassId="1" schema="gml" abstract="true">
      <attribute path="@id" column="gmlid" type="string" schema="gml"/>
      <attribute path="description" column="description" type="string" schema="gml"/>
      <complexAttribute path="name" schema="gml">
        <attribute path="." column="name" type="string" schema="gml"/>
        <attribute path="@codeSpace" column="name_codespace" type="string" schema="gml"/>
      </complexAttribute>
      <attribute path="id" column="id" type="integer" queryable="false" schema="citydb"/>
      <attribute path="objectclass_id" column="objectclass_id" type="integer" queryable="false" schema="citydb"/>
    </objectType>
  </objectTypes>

  <featureTypes>
    <!-- GML module -->
    <featureType id="AbstractFeatureType" path="_Feature" table="cityobject" schema="gml" objectClassId="2" abstract="true">
      <attribute path="@id" column="gmlid" type="string" schema="gml"/>
      <attribute path="description" column="description" type="string" schema="gml"/>
      <complexAttribute path="name" schema="gml">
        <attribute path="." column="name" type="string" schema="gml"/>
        <attribute path="@codeSpace" column="name_codespace" type="string" schema="gml"/>
      </complexAttribute>
      <geometryProperty path="boundedBy" inlineColumn="envelope" type="Envelope" schema="gml"/>
      <attribute path="id" column="id" type="integer" queryable="false" schema="citydb"/>
      <attribute path="objectclass_id" column="objectclass_id" type="integer" queryable="false" schema="citydb"/>
      <attribute path="lastModificationDate" column="last_modification_date" type="timestamp" schema="citydb"/>
      <attribute path="updatingPerson" column="updating_person" type="string" schema="citydb"/>
      <attribute path="reasonForUpdate" column="reason_for_update" type="string" schema="citydb"/>